round	value	daily_double	category	comments	answer	question	air_date	notes
1	300	no	BRITISH POLITICS	-	An MP who's not a member of the government or an official opposition spokesman is a "back" 1 of these	bencher	1993-02-04	-
1	400	no	BRITISH POLITICS	-	This group drafts & approves the queen's speech that opens a session of Parliament	the cabinet	1993-02-04	-
1	500	no	BRITISH POLITICS	-	If you've got a P.C. after your style, name & honors, it means you're a member of this	priivy council	1993-02-04	-
1	100	no	SPORTS	-	In September 1992 Manon Rheaume became the 1st woman to play a game in 1 of the 4 major team sports, this one	ice hockey	1993-02-04	-
1	200	no	SPORTS	-	After 9 attempts, jockey Pat Day finally won this horse race on May 2, 1992 riding Lil E. Tee, a 16-1 long shot	the Kentucky Derby	1993-02-04	-
1	300	no	SPORTS	-	In 1992 coach Joe Gibbs led this team to its third Super Bowl win by defeating Buffalo, 37-24	Washington Redskins	1993-02-04	-
1	400	no	SPORTS	-	Brian Shimer & football player Herschel Walker finished 7th in this 2-man event in the 1992 Winter Olympics	2-man bobsled	1993-02-04	-
1	500	no	SPORTS	-	This Texas Rangers pitcher ended the 1992 season with 319 victories & a record 5,668 career strikeouts	Nolan Ryan	1993-02-04	-
1	100	no	FASHION	-	In the early '70s, Women's Wear Daily coined this "sizzling" term for women's short shorts	hot pants	1993-02-04	-
1	200	no	FASHION	-	Formerly worn as a decorative item, this garment is now used mainly in the kitchen	apron	1993-02-04	-
1	300	no	FASHION	-	In 1986 this Meryl Streep-Robert Redford film sparked a new trend in safari wear	Out of Africa	1993-02-04	-
1	400	no	FASHION	-	This main outer garment of Hindu women consists of a piece of cloth usually 5  to 7 yards long	sari	1993-02-04	-
1	500	no	FASHION	-	The Basque is the most common style of this soft, round cap	beret	1993-02-04	-
1	100	no	BOTANY	-	Pollination by these is called ornithophily	birds	1993-02-04	-
1	200	no	BOTANY	-	An epiphyte is a plant that doesn't have these in the soil; it's supported by another plant	roots	1993-02-04	-
1	300	no	BOTANY	-	It's actually a modified reduced branch if you get our point...& rose gardeners do	thorn	1993-02-04	-
1	400	no	BOTANY	-	A fertilized ovule develops into one of these	seed	1993-02-04	-
1	500	no	BOTANY	-	It's the process by which a scion is put on a stock	grafting	1993-02-04	-
1	100	no	PEOPLE & PLACES	-	Angelenos don't live in heaven but in this U.S. city	Los Angeles	1993-02-04	-
1	200	no	PEOPLE & PLACES	-	Kikuyu, Kalenjin & Kamba are 3 of the ethnic groups in this country whose name also starts with "K\"	Kenya	1993-02-04	-
1	300	no	PEOPLE & PLACES	-	Some of these Florida Indians live in open, palm-thatched huts called chickees	Seminoles	1993-02-04	-
1	500	yes	PEOPLE & PLACES	-	North China was once called this, a name derived from the Khitan people of Mongolia	Cathay	1993-02-04	-
1	500	no	PEOPLE & PLACES	-	When these nomads wandered to Europe, they claimed to come from "Little Egypt", hence their name	Gypsies	1993-02-04	-
1	100	no	THE "I"'s HAVE IT	-	In the U.S., Washington is second only to this state in potato production	Idaho	1993-02-04	-
1	200	no	THE "I"'s HAVE IT	-	It can be a native of Spain or Portugal	Iberian	1993-02-04	-
1	300	no	THE "I"'s HAVE IT	-	Encyclopedia Americana says these South American Indians once made cloth from bat hair	Incas	1993-02-04	-
1	400	no	THE "I"'s HAVE IT	-	This kind of manuscript is "lit up" with ornamental letters & colorful decorations	illuminated	1993-02-04	-
1	500	no	THE "I"'s HAVE IT	-	Of all the fish diseases we know, this has the shortest name	ich	1993-02-04	-
2	200	no	THE HUMAN BODY	-	In a canal in this part of the body there are about 4,000 wax-producing glands	ear	1993-02-04	-
2	400	no	THE HUMAN BODY	-	A disturbance in the ninth cranial nerve & in the muscles of the esophagus may cause a "lumpy" feeling here	throat	1993-02-04	-
2	600	no	THE HUMAN BODY	-	Home kits checking for this look for the human chorionic gonadotropin, or HCG, hormone	pregnancy	1993-02-04	-
2	800	no	THE HUMAN BODY	-	In '92 the world's 1st transplant of this baboon organ to a human was performed at the University of Pittsburgh	liver	1993-02-04	-
2	1000	no	THE HUMAN BODY	-	To make them "beautiful women", Italian women once used drops of belladonna to enlarge these	pupils in their eyes	1993-02-04	-
2	200	no	SITCOMS	-	As the Fonz' popularity rose, so did this actor's billing on "Happy Days\"	Henry Winkler	1993-02-04	-
2	400	no	SITCOMS	-	Max Baer, Jr. played both Jethro & Jethrene Bodine on this sitcom	The Beverly Hillbillies	1993-02-04	-
2	600	no	SITCOMS	-	She's only about 3 years older than Beatrice Arthur, whose mother she played on "Golden Girls\"	Estelle Getty	1993-02-04	-
2	800	no	SITCOMS	-	The theme song of this CBS sitcom is "Georgia on My Mind\"	Designing Women	1993-02-04	-
2	1000	no	SITCOMS	-	He played Rob's brother Stacy Petrie on "The Dick Van Dyke Show\"	Jerry Van Dyke	1993-02-04	-
2	200	no	CAPES	-	In 1958, the first U.S. satellite, Explorer I, was sent into orbit from this cape	Cape Canaveral	1993-02-04	-
2	400	no	CAPES	-	Dutch sailor Willem Schouten named this South American cape for his hometown in Holland	Cape Horn	1993-02-04	-
2	1000	yes	CAPES	-	North Carolina's southernmost point received this name because sailors dreaded the dangerous waters nearby	Cape Fear	1993-02-04	-
2	800	no	CAPES	-	Cape Gris-Nez, which extends into this strait, is the French point nearest to Great Britain	Strait of Dover	1993-02-04	-
2	1000	no	CAPES	-	Gloucester & Rockport are the main towns on this Mass. cape about 30 miles northeast of Boston	Cape Ann	1993-02-04	-
2	200	no	NOVEL CHARACTERS	-	Near the start of this D.H. Lawrence novel, Clifford Chatterley marries Constance Reid	Lady Chatterley's Lover	1993-02-04	-
2	400	no	NOVEL CHARACTERS	-	She steals her sister's beau Frank Kennedy & marries him to get money to save Tara	Scarlett O'Hara	1993-02-04	-
2	600	no	NOVEL CHARACTERS	-	Convinced he is a bank robber, detective Fix follows this man "Around the World in Eighty Days\"	Phileas Fogg	1993-02-04	-
2	800	no	NOVEL CHARACTERS	-	At the beginning of his novel "The Trial", Joseph K. is arrested	Franz Kafka	1993-02-04	-
2	1500	yes	NOVEL CHARACTERS	-	The first section of this Faulkner book takes place in the mind of the idiot Benjy Compson	The Sound and the Fury	1993-02-04	-
2	200	no	THE FRENCH REVOLUTION	-	The Directory ruled for 4 years until he seized power November 9, 1799	Napoleon Bonaparte	1993-02-04	-
2	400	no	THE FRENCH REVOLUTION	-	A Paris mob stormed this structure for its weapons July 14, 1789	the Bastille	1993-02-04	-
2	600	no	THE FRENCH REVOLUTION	-	When he became king in 1774, he supposedly said, "What I should like most is to be loved" -- he wasn't	Louis XVI	1993-02-04	-
2	800	no	THE FRENCH REVOLUTION	-	On October 5, 1789 thousands of women marched to Versailles demanding this food	bread	1993-02-04	-
2	1000	no	THE FRENCH REVOLUTION	-	9 Thermidor or July 27, 1794 is marked as the day this tyrant fell	Robespierre	1993-02-04	-
2	200	no	LET THEM EAT CAKE	-	Heloise hints you can substitute club soda for this when you use German chocolate cake mix	ordinary water	1993-02-04	-
2	400	no	LET THEM EAT CAKE	-	This dessert with a diminutive name is often topped with strawberries	shortcake	1993-02-04	-
2	600	no	LET THEM EAT CAKE	-	You can eat Zuppa Inglese with a fork, not a spoon, even though its name means this in Italian	English soup	1993-02-04	-
2	800	no	LET THEM EAT CAKE	-	Funnel cakes are a specialty of these people who moved to William Penn's colony in the 1600s	Pennsylvania Dutch	1993-02-04	-
2	1000	no	LET THEM EAT CAKE	-	Cassata Alla Siciliana, or Sicilian Cream Cake, is made with this cheesecake cheese	ricotta	1993-02-04	-
3	0	no	OSCAR-WINNING FILMS	-	A series of articles about corruption in the longshoremen's union inspired this 1954 film	On the Waterfront	1993-02-04	-
1	100	no	THE SOUTH	-	Natchez in this state is known for its lovely antebellum mansions; many of them are open to tourists	Mississippi	1993-02-05	-
1	200	no	THE SOUTH	-	The shag, not the Charleston, is South Carolina's state one of these	a dance	1993-02-05	-
1	300	no	THE SOUTH	-	The annual Jeanie festival in White Springs, Florida honors this composer who dreamed of Jeanie	Stephen Foster	1993-02-05	-
1	400	no	THE SOUTH	-	In 1926 the Rockefellers began restoring the historic area of this colonial capital of Virginia	Williamsburg	1993-02-05	-
1	500	no	THE SOUTH	-	This Tennessee city's architecture helped earn it the nickname "The Athens of the South\"	Nashville	1993-02-05	-
1	100	no	MOVIE TRIVIA	-	Irish actress Geraldine Fitzgerald played the woman who married Heathcliff in this 1939 classic	Wuthering Heights	1993-02-05	-
1	200	no	MOVIE TRIVIA	-	Annette Bening came on like gangbusters when she wore a gown from this gangster film to the 1990 Oscars	Bugsy	1993-02-05	-
1	300	no	MOVIE TRIVIA	-	Of bubble gum, flubber or blubber, the one Fred MacMurray invented in a 1961 film	flubber	1993-02-05	-
1	400	no	MOVIE TRIVIA	-	John Chancellor reportedly turned down the role in this 1976 film that won Peter Finch an Oscar	Network	1993-02-05	-
1	500	no	MOVIE TRIVIA	-	This "Mrs. Miniver" star played Eleanor Roosevelt in the 1960 film "Sunrise at Campobello\"	Greer Garson	1993-02-05	-
1	100	no	THE ENVIRONMENT	-	Global warming caused by this "effect" could force the evacuation of some coastal lowlands	the greenhouse effect	1993-02-05	-
1	200	no	THE ENVIRONMENT	-	Trees help humanity by absorbing this gas, but it's released to the atmosphere when they are burned	carbon dioxide	1993-02-05	-
1	300	no	THE ENVIRONMENT	-	These converters help release pollutants from automobile exhaust	catalytic converters	1993-02-05	-
1	400	no	THE ENVIRONMENT	-	The pH value of acid rain is equivalent to that of this common salad dressing ingredient	vinegar	1993-02-05	-
1	1000	yes	THE ENVIRONMENT	-	This type of garbage dump, used for about 80% of U.S. waste, often leaks toxic chemicals	a landfill	1993-02-05	-
1	100	no	1992	-	During one week in May, 7 people died climbing this Alaskan mountain	Mt. McKinley	1993-02-05	-
1	200	no	1992	-	In July this new Israeli prime minister went to Cairo to meet President Mubarak	Yitzhak Rabin	1993-02-05	-
1	300	no	1992	-	After Slovakia's parliament declared sovereignty, he quit as president of Czechoslovakia	Václav Havel	1993-02-05	-
1	400	no	1992	-	Founded in 1779, the Elizabeth Daily Journal, this state's oldest newspaper, folded	New Jersey	1993-02-05	-
1	500	no	1992	-	A deadlock over how to close a $10.7-billion budget shortfall caused this state to issue IOUs	California	1993-02-05	-
1	100	no	CHOCOLATE	-	It's the only candy we know with "Duds" in its name	Milk Duds	1993-02-05	-
1	200	no	CHOCOLATE	-	This vegetable fat used in soap & cosmetics is a by-product of the chocolate industry	cocoa butter	1993-02-05	-
1	300	no	CHOCOLATE	-	Theobroma Cacao, the scientific name of the cacao tree, means that it's the "food of" these beings	the gods	1993-02-05	-
1	400	no	CHOCOLATE	-	Chocolate, garlic & onions are 3 of the main ingredients in this spicy Mexican sauce	mole	1993-02-05	-
1	500	no	CHOCOLATE	-	A chocolate company is named for this legendary lady who graces its signature gold ballotins	(Lady) Godiva	1993-02-05	-
1	100	no	\"G" WHIZ	-	Often caused by cold, this skin condition could be called "waterfowl bumps\"	goosebumps	1993-02-05	-
1	200	no	\"G" WHIZ	-	These abandoned communities could be called "spectre cities\"	ghost towns	1993-02-05	-
1	300	no	\"G" WHIZ	-	Jubilant joy, or the kind of club that might sing about it	a glee club	1993-02-05	-
1	400	no	\"G" WHIZ	-	A voracious eater, or someone with an enormous capacity "for work" or "for punishment\"	a glutton	1993-02-05	-
1	500	no	\"G" WHIZ	-	Some species of this ratlike rodent, a popular pet, are called jirds	gerbils	1993-02-05	-
2	200	no	THE 19th CENTURY	-	David Livingstone's body was interred in this London landmark in 1874	Westminster Abbey	1993-02-05	-
2	400	no	THE 19th CENTURY	-	In 1870 the first rubber company west of the Alleghenies was founded in Akron, Ohio by this man	Goodrich	1993-02-05	-
2	600	no	THE 19th CENTURY	-	This president ran for reelection in 1872 against fellow Republican Horace Greeley, who was endorsed by the Democrats	Grant	1993-02-05	-
2	1000	yes	THE 19th CENTURY	-	In 1893 this labor leader founded the American Railway Union	(Eugene) Debs	1993-02-05	-
2	1000	no	THE 19th CENTURY	-	On Jan. 5, 1895, in front of French troops, he was stripped of his buttons & badges & had his sword broken	Alfred Dreyfus	1993-02-05	-
2	200	no	CHEMISTRY	-	Mr. Potato Head could tell you the 3 best-known polysaccharides are cellulose, glycogen & this	starch	1993-02-05	-
2	400	no	CHEMISTRY	-	Used in rechargeable batteries & to protect other metals from corrosion, its symbol is Cd	cadmium	1993-02-05	-
2	600	no	CHEMISTRY	-	An atom that loses one of these becomes a cation, a positively charged ion	an electron	1993-02-05	-
2	800	no	CHEMISTRY	-	Burn a piece of sodium in a flask filled with chlorine gas & the resulting white powder is this	salt	1993-02-05	-
2	4000	yes	CHEMISTRY	-	This semiconducting element makes up 27.7% of the mass of the earth's crust	silicon	1993-02-05	-
2	200	no	FAMOUS WOMEN	-	Now 80, this "French Chef" says she'll go until she drops, & "that should be about 95\"	Julia Child	1993-02-05	-
2	400	no	FAMOUS WOMEN	-	This comedienne got her start on TV as the girlfriend of Jerry Mahoney, & we're not pulling your ear!	Carol Burnett	1993-02-05	-
2	600	no	FAMOUS WOMEN	-	It's the first name of cartoonist Guisewite, or her famous comic strip	Cathy	1993-02-05	-
2	800	no	FAMOUS WOMEN	-	The original Gibson Girl, Irene Langhorne Gibson, was an older sister of this American-born British "Lady\"	Lady (Nancy) Astor	1993-02-05	-
2	1000	no	FAMOUS WOMEN	-	She founded the Elsa Wild Animal Appeal in England in 1961& in the U.S. in 1969	Joy Adamson	1993-02-05	-
2	200	no	COUNTRIES OF THE WORLD	-	About 94% of this country's population belongs to the Han nationality	China	1993-02-05	-
2	400	no	COUNTRIES OF THE WORLD	-	This country's 4 geographical provinces are Connaught, Leinster, Munster & part of Ulster	Ireland	1993-02-05	-
2	600	no	COUNTRIES OF THE WORLD	-	The Gallipoli Peninsula, a site of major action in WWI, is part of this country	Turkey	1993-02-05	-
2	800	no	COUNTRIES OF THE WORLD	-	Bob Hawke served as prime minister of this country from 1983 to 1991	Australia	1993-02-05	-
2	1000	no	COUNTRIES OF THE WORLD	-	The Bryan-Chamorro treaty of 1914 gave the U.S. the right to build a canal thru this Central American country	Nicaragua	1993-02-05	-
2	200	no	POETRY	-	This American poet wrote several versions of his lament "Lenore\"	(Edgar Allan) Poe	1993-02-05	-
2	400	no	POETRY	-	The 9th sect. of this Longfellow poem begins, "On the shores of Gitche Gumee, of the shining Big-Sea-Water\"	Hiawatha	1993-02-05	-
2	600	no	POETRY	-	T.S. Eliot asked "Do I dare to eat a peach" in this title character's "Love Song\"	J. Alfred Prufrock	1993-02-05	-
2	800	no	POETRY	-	Books in this Tennyson work include "Merlin and Vivien" & "Lancelot and Elaine\"	\"The Idylls of the King\"	1993-02-05	-
2	1000	no	POETRY	-	\"Ah but a man's reach should exceed his grasp, or what's a heaven for?" is from his "Andrea Del Sarto\"	Robert Browning	1993-02-05	-
2	200	no	THE INSTRUMENT PLAYED	-	Duane Eddy, Andres Segovia & Chuck Berry	a guitar	1993-02-05	-
2	400	no	THE INSTRUMENT PLAYED	-	Ginger Baker, Karen Carpenter & Buddy Rich	the drums	1993-02-05	-
2	600	no	THE INSTRUMENT PLAYED	-	Toots Thielmans, Larry Addler & Stevie Wonder	the harmonica	1993-02-05	-
2	800	no	THE INSTRUMENT PLAYED	-	Annie Whitehead, Kid Ory & Tommy Dorsey	the trombone	1993-02-05	-
2	1000	no	THE INSTRUMENT PLAYED	-	Freddy Martin, Boots Randolph & John Coltrane	the saxophone	1993-02-05	-
3	0	no	OPERA	-	This 20th century opera was inspired by Hieronymus Bosch's painting "The Adoration of the Magi\"	Amahl and the Night Visitors	1993-02-05	-
1	100	no	WORLD FACTS	-	Because it uses geothermal energy this Icelandic capital is often called the "Smokeless City\"	Reykjavik	1993-02-10	-
1	200	no	WORLD FACTS	-	Egypt is the world's leading grower of these palm fruits	dates	1993-02-10	-
1	300	no	WORLD FACTS	-	You can visit her birthplace in Frankfurt & the annex where she wrote her diary in Amsterdam	Anne Frank	1993-02-10	-
1	400	no	WORLD FACTS	-	One of these, the Sistema de Transporte Collectivo, opened in 1969 in Mexico City	subway	1993-02-10	-
1	500	no	WORLD FACTS	-	This tiny republic is about 10 miles from Rimini, Italy	San Marino	1993-02-10	-
1	100	no	LE CINEMA SCHWARZENEGGER	-	The line "I'll Be Back" came from this 1984 hit	The Terminator	1993-02-10	-
1	200	no	LE CINEMA SCHWARZENEGGER	-	In 1988 Arnold played Julius Benedict, a man separated at birth from his twin, played by this man	Danny DeVito	1993-02-10	-
1	300	no	LE CINEMA SCHWARZENEGGER	-	Once a barbarian, a destroyer & a commando, Arnold turned teacher in this 1990 release	Kindergarten Cop	1993-02-10	-
1	400	no	LE CINEMA SCHWARZENEGGER	-	Before going after Michael Douglas, she tried to kill Arnold in "Total Recall\"	Sharon Stone	1993-02-10	-
1	500	no	LE CINEMA SCHWARZENEGGER	-	Arnold played himself in this 1977 documentary  that also featured Lou Ferrigno	Pumping Iron	1993-02-10	-
1	100	no	HORSES	-	This Scottish pony was brought to America in the 1800s	Shetland pony	1993-02-10	-
1	200	no	HORSES	-	It's also known as the Plantation Walking Horse	Tennessee Walker	1993-02-10	-
1	300	no	HORSES	-	Some Bedouins trace this breed's ancestry to Baz, a mare tamed by a descendant of Noah	Arabian	1993-02-10	-
1	400	no	HORSES	-	Many of these performing horses are raised at Austria's Piber Stud near Graz	Lipizzaner Stallions	1993-02-10	-
1	500	no	HORSES	-	The Lusitano is this country's version of the Spanish Andalusian	Portugal	1993-02-10	-
1	100	no	LIBRARIES	-	This state maintains a free library for the public & the legislature in the capital of Augusta	Maine	1993-02-10	-
1	200	no	LIBRARIES	-	This school in New Haven, Conn. is home to the Beinecke Rare Book & Manuscript Library	Yale	1993-02-10	-
1	300	no	LIBRARIES	-	This city's Enoch Pratt Free Library has Maryland's largest collection of books	Baltimore	1993-02-10	-
1	400	no	LIBRARIES	-	This city is the site of the Mayo Medical Library	Rochester, Minnesota	1993-02-10	-
1	1300	yes	LIBRARIES	-	Outstanding collections of William Faulkner & Stark Young can be found at the library of this university	University of Mississippi	1993-02-10	-
1	100	no	EDIBLE PHRASES	-	A phrase about having this & eating it too appeared in print as far back as 1546	cake	1993-02-10	-
1	200	no	EDIBLE PHRASES	-	A completely composed person is said to be as cool as this member of the gourd family	cucumber	1993-02-10	-
1	300	no	EDIBLE PHRASES	-	\"What is sauce for the goose" is also this	sauce for the gander	1993-02-10	-
1	400	no	EDIBLE PHRASES	-	Someone who's not up to snuff can't cut this condiment	the mustard	1993-02-10	-
1	500	no	EDIBLE PHRASES	-	When you really destroy someone, you "make" this pie ingredient "of him\"	mincemeat	1993-02-10	-
1	100	no	LEFTOVERS	-	The male of this bird is sometimes called a gobbler	turkey	1993-02-10	-
1	200	no	LEFTOVERS	-	In John Bunyan's "The Pilgrim's Progress", the celestial city represents this	heaven	1993-02-10	-
1	300	no	LEFTOVERS	-	A Greek cave on Philopapus Hill is said to have served as the prison where this philosopher was confined	Socrates	1993-02-10	-
1	400	no	LEFTOVERS	-	It's the name shared by England's largest lake & Oscar Wilde's "Lady\"	Windermere	1993-02-10	-
1	500	no	LEFTOVERS	-	Haile Selassie belonged to a dynasty of Ethiopian rulers who claimed descent from this Biblical couple	King Solomon & the Queen of Sheba	1993-02-10	-
2	200	no	ASTRONOMY	-	Ganymede is this largest planet's largest satellite	Jupiter	1993-02-10	-
2	400	no	ASTRONOMY	-	One of these, named for Johann Franz Encke, returns every 3.3 years	comet	1993-02-10	-
2	600	no	ASTRONOMY	-	In 1916 Karl Schwarzschild demonstrated that very massive bodies could become these "dark" objects	black holes	1993-02-10	-
2	800	no	ASTRONOMY	-	Also called Crux australis, this constellation is the smallest in the sky	Southern cross	1993-02-10	-
2	1000	no	ASTRONOMY	-	Alcyone is the brightest star in this star cluster sometimes called the Seven Sisters	Pleiades	1993-02-10	-
2	200	no	BUSINESS PARTNERS	-	He was not only Eberhard Anheuser's partner, but his son-in-law as well	(Adolphus) Busch	1993-02-10	-
2	400	no	BUSINESS PARTNERS	-	In 1907 A.L. Neiman, his wife Carrie & this partner opened their first store in Dallas	Marcus	1993-02-10	-
2	600	no	BUSINESS PARTNERS	-	After he adapted the repeating action for revolvers, he & Horace Smith formed a company to produce them	Wesson	1993-02-10	-
2	800	no	BUSINESS PARTNERS	-	The company founded by this pair introduced the electric hammer in the 1930s & the Dustbuster in 1979	Black & Decker	1993-02-10	-
2	1000	no	BUSINESS PARTNERS	-	In 1923 John Orr Young & this man left the N.W. Ayer Agency to start their own advertising co.	Rubicam	1993-02-10	-
2	200	no	CLASSICAL MUSIC	-	This composer's "The Ring of the Nibelung" was written over a 20-year period	Wagner	1993-02-10	-
2	400	no	CLASSICAL MUSIC	-	His works for solo piano include 3 sonatas & about 18 waltzes & 15 polonaises	Chopin	1993-02-10	-
2	600	no	CLASSICAL MUSIC	-	In 1860 this "Rigoletto" composer was elected to Italy's Chamber of Deputies	Verdi	1993-02-10	-
2	800	no	CLASSICAL MUSIC	-	In 1875 Franz Liszt became president of the Academy of Music in this city	Budapest	1993-02-10	-
2	1000	no	CLASSICAL MUSIC	-	The father of this priest & composer was a violinist at St. Mark's Cathedral in Venice	Vivaldi	1993-02-10	-
2	200	no	HISTORY	-	After the Amer. Rev., T. Kosciusko returned to this country where he led a fight for independence	Poland	1993-02-10	-
2	400	no	HISTORY	-	In 1985 Vietnamese troops drove the Khmer Rouge from the last of their bases in this country	Cambodia	1993-02-10	-
2	600	no	HISTORY	-	In 1632 this country's king Gustavus Adolphus was killed in the Battle of Lutzen	Sweden	1993-02-10	-
2	1000	yes	HISTORY	-	From 323 to 30 B.C., all 15 of Egypt's Macedonian kings shared this name	Ptolemy	1993-02-10	-
2	1000	no	HISTORY	-	In France this dynasty ended in 987 with the death of Louis V, a descendant of Charlemagne	Carolingian	1993-02-10	-
2	200	no	REJECTED	-	Several passages in this 1776 document by Thomas Jefferson were rejected by Congress	Declaration of Independence	1993-02-10	-
2	400	no	REJECTED	-	The nymph Echo was rejected by this man too in love with himself	Narcissus	1993-02-10	-
2	2000	yes	REJECTED	-	Rejected for missionary work in China, this Scot went to Africa in 1841	(David) Livingstone	1993-02-10	-
2	200	no	\"W"RITERS	-	His "The Time Machine" was first published as "The Chronic Argonauts\"	H.G. Wells	1993-02-10	-
2	400	no	\"W"RITERS	-	He left the L.A. Police Department in 1974, the year after "The Onion Field" came out	Joe Wambaugh	1993-02-10	-
2	600	no	\"W"RITERS	-	He narrated a recording of his kids' story "Charlotte's Web\"	E.B. White	1993-02-10	-
2	800	no	\"W"RITERS	-	He won 3 Pulitzers: 1 for "All the King's Men" & 2 for poetry	Robert Penn Warren	1993-02-10	-
2	1000	no	\"W"RITERS	-	The subtitle of his "The Loved One" is "An Anglo-American Tragedy\"	Evelyn Waugh	1993-02-10	-
3	0	no	NEWSPAPERS	-	It was once advertised as "The Daily Diary of the American Dream\"	The Wall Street Journal	1993-02-10	-
1	100	no	CHILDREN'S LITERATURE	-	He dedicated "The Prince and the Pauper" to his daughters Susie & Clara	Mark Twain	1993-02-16	1993 Teen Tournament quarterfinal game 2.
1	200	no	CHILDREN'S LITERATURE	-	When Wilbur the pig meets her, she's hanging from her home waving one of her 8 legs at him	Charlotte	1993-02-16	1993 Teen Tournament quarterfinal game 2.
1	300	no	CHILDREN'S LITERATURE	-	Lucy Maud Montgomery called her 1909 sequel to "Anne of Green Gables" "Anne of" this place	Avonlea	1993-02-16	1993 Teen Tournament quarterfinal game 2.
1	400	no	CHILDREN'S LITERATURE	-	Englishwoman who based Mrs. Tiggy-Winkle on her own pet hedgehog who drank from a doll's teacup	Beatrix Potter	1993-02-16	1993 Teen Tournament quarterfinal game 2.
1	500	no	CHILDREN'S LITERATURE	-	He emigrated to England after his aunt Lucy moved to the Home for Retired Bears in Lima	Paddington	1993-02-16	1993 Teen Tournament quarterfinal game 2.
1	100	no	SPORTS	-	When first played in 1967, it was called the AFL-NFL World Championship Game	Super Bowl	1993-02-16	1993 Teen Tournament quarterfinal game 2.
1	200	no	SPORTS	-	On Nov. 2, 1992, this L.A. Laker retired from professional basketball for the second time in a year	Magic Johnson	1993-02-16	1993 Teen Tournament quarterfinal game 2.
1	300	no	SPORTS	-	In 1992 this team won 3 World Series games in their last at bat	Toronto Blue Jays	1993-02-16	1993 Teen Tournament quarterfinal game 2.
1	400	no	SPORTS	-	With earnings exceeding $18 million, this Czech player is the career prize money leader in men's tennis	Ivan Lendl	1993-02-16	1993 Teen Tournament quarterfinal game 2.
1	500	no	SPORTS	-	In 1991 Mike Powell snapped this man's 10-year, 65-meet unbeaten streak in the long jump	Carl Lewis	1993-02-16	1993 Teen Tournament quarterfinal game 2.
1	100	no	SPECIES IDs	-	If you see a snake flare its hood, it's one of these & it's poisonous	cobra	1993-02-16	1993 Teen Tournament quarterfinal game 2.
1	200	no	SPECIES IDs	-	The ears on the African variety of this mammal are twice as big as those on the Indian	elephant	1993-02-16	1993 Teen Tournament quarterfinal game 2.
1	300	no	SPECIES IDs	-	If a bear is white & can swim, it's this type of bear	polar bear	1993-02-16	1993 Teen Tournament quarterfinal game 2.
1	400	no	SPECIES IDs	-	The common variety of this mammal has black fur & a single or double white stripe down its back	skunk	1993-02-16	1993 Teen Tournament quarterfinal game 2.
1	2000	yes	SPECIES IDs	-	Its pouch is attached all the way around the lower mandible & may hold over 12 quarts	pelican	1993-02-16	1993 Teen Tournament quarterfinal game 2.
