round	value	daily_double	category	comments	answer	question	air_date	notes
2	600	no	ROCKS & MINERALS	-	To identify a meteorite, Peterson's guide says to look for iron & this metal	nickel	1993-05-14	1993 College Championship final game 2.
2	800	no	ROCKS & MINERALS	-	The fossils in this type of rock may remain even after it's changed into marble	limestone	1993-05-14	1993 College Championship final game 2.
2	1000	no	ROCKS & MINERALS	-	Shale changes into this rock metamorphically & also by changing 2 letters	slate	1993-05-14	1993 College Championship final game 2.
2	200	no	RHODES SCHOLARS	-	Admiral Stansfield Turner who headed this agency under Carter didn't keep his scholarship a secret	the CIA	1993-05-14	1993 College Championship final game 2.
2	400	no	RHODES SCHOLARS	-	Daniel J. Boorstin & James H. Billington are the last 2 scholars to run this library	the Library of Congress	1993-05-14	1993 College Championship final game 2.
2	600	no	RHODES SCHOLARS	-	This singer was picked to go to Oxford & to co-star with Barbra Streisand in "A Star is Born\"	Kris Kristofferson	1993-05-14	1993 College Championship final game 2.
2	800	no	RHODES SCHOLARS	-	The dean of students might be able to tell you that this Dean was Secretary of State during the '60s	Rusk	1993-05-14	1993 College Championship final game 2.
2	2000	yes	RHODES SCHOLARS	-	This former Arkansas senator who set up a scholarship fund won a scholarship to Oxford	(J. William) Fulbright	1993-05-14	1993 College Championship final game 2.
2	200	no	ODE TO ENGLAND	-	From France's Calais this city's a strait away; you should watch when you walk on its cliffs of white chalk	Dover	1993-05-14	1993 College Championship final game 2.
2	400	no	ODE TO ENGLAND	-	When these wars were in bloom, Richard of York met his doom	the Wars of the Roses	1993-05-14	1993 College Championship final game 2.
2	600	no	ODE TO ENGLAND	-	Around Wiltshire they tell a story that this rock group was an observatory	Stonehenge	1993-05-14	1993 College Championship final game 2.
2	800	no	ODE TO ENGLAND	-	In the P.M.'s chair he was sittin' during the 1940-41 Battle of Britain	Churchill	1993-05-14	1993 College Championship final game 2.
2	1000	no	ODE TO ENGLAND	-	William's protection against besiegers, it's now the home of the Beefeaters	the Tower of London	1993-05-14	1993 College Championship final game 2.
2	200	no	TEA TIME	-	Some people do this by reading tea leaves	predict the future	1993-05-14	1993 College Championship final game 2.
2	400	no	TEA TIME	-	It's the most popular way to serve tea in the U.S., but the British think it's "not so hot\"	iced tea	1993-05-14	1993 College Championship final game 2.
2	600	no	TEA TIME	-	Darjeeling tea is grown in Darjeeling, India, in the foothills of these mountains	the Himalayas	1993-05-14	1993 College Championship final game 2.
2	800	no	TEA TIME	-	The leading tea-growing country in Africa, it's known for its coffee plantations, too	Kenya	1993-05-14	1993 College Championship final game 2.
2	1000	no	TEA TIME	-	This great Roman orator coined the phrase we translate as "a tempest in a teapot\"	Cicero	1993-05-14	1993 College Championship final game 2.
3	0	no	ANCIENT ROME	-	General Publius Scipio won the surname "Africanus" for beating this man at the 202 B.C. Battle of Zama	Hannibal	1993-05-14	1993 College Championship final game 2.
1	100	no	WORLD POTPOURRI	-	Barbados has a Trafalgar Square, too & its statue of this hero is older than the one in London	Nelson	1993-05-20	-
1	200	no	WORLD POTPOURRI	-	Stuttgart in this country is so named because it used to be the site of a stud farm, or stuotgarten	Germany	1993-05-20	-
1	300	no	WORLD POTPOURRI	-	These 2 European countries whose names begin with "Sw" were both neutral during WWI & WWII	Switzerland and Sweden	1993-05-20	-
1	400	no	WORLD POTPOURRI	-	The name of this South American city is Portuguese for "River of January\"	Rio de Janeiro	1993-05-20	-
1	500	no	WORLD POTPOURRI	-	Medieval poet Snorri Sturluson wroth the Prose Edda, one of this country's greatest literary works	Iceland	1993-05-20	-
1	100	no	TV WESTERNS	-	On Sept. 10, 1955, John Wayne introduced the 1st episode of this western set in Dodge City, Kansas	Gunsmoke	1993-05-20	-
1	200	no	TV WESTERNS	-	Its theme song began, "Rollin' rollin' rollin', tho' the streams are swollen, keep them dogies rollin'...\"	Rawhide	1993-05-20	-
1	300	no	TV WESTERNS	-	This TV western was set on the Barkley Ranch in the 1870s	The Big Valley	1993-05-20	-
1	400	no	TV WESTERNS	-	This sidekick of the Cisco Kid was played by Leo Carrillo, who was in his 70s when he began the role	Pancho	1993-05-20	-
1	500	no	TV WESTERNS	-	Roy Rogers rode Trigger, Dale Evans this horse	Buttermilk	1993-05-20	-
1	100	no	SUBMARINES	-	By the mid-1950s this country had about 375 subs in various oceans & seas	the Soviet Union	1993-05-20	-
1	200	no	SUBMARINES	-	After WWI the Allied Submarine Detection Investigation Committee developed this to detect subs	sonar	1993-05-20	-
1	300	no	SUBMARINES	-	Until this arrived in the 1950s, almost all subs used diesel-electric power	nuclear power	1993-05-20	-
1	400	no	SUBMARINES	-	Subs usually have 2 of these optical devices, 1 for general use, 1 for the attack	periscopes	1993-05-20	-
1	500	no	SUBMARINES	-	Air trapped in these tanks makes a sub float	ballast tanks	1993-05-20	-
1	100	no	PRESIDENTIAL RELATIVES	-	Patricia Ann Reagan uses this name professionally	Patti Davis	1993-05-20	-
1	200	no	PRESIDENTIAL RELATIVES	-	Princess Julia Cantacuzene, a granddaughter of this president & Civil War general died in 1975 at the age of 99	Grant	1993-05-20	-
1	300	no	PRESIDENTIAL RELATIVES	-	Writer Jessamyn West babysat this cousin from Calif. who grew up to become president in the 1960s	Nixon	1993-05-20	-
1	400	no	PRESIDENTIAL RELATIVES	-	It was the first name of William Henry Harrison's father & grandson	Benjamin	1993-05-20	-
1	500	no	PRESIDENTIAL RELATIVES	-	Unopened six-packs of this beverage named for Jimmy Carter's brother are now a collector's item	Billy Beer	1993-05-20	-
1	100	no	SEWING	-	Lengths of these include cap, short, three-quarter, seven-eighths & long	sleeves	1993-05-20	-
1	200	no	SEWING	-	If the fabric has a nap, you should lay out the pieces of this in one direction & cut them out	the pattern	1993-05-20	-
1	300	no	SEWING	-	Types of these include running & back	stitches	1993-05-20	-
1	400	no	SEWING	-	Numbers on spools of thread refer to this; to work on material like organdy or net, use no. 100	thickness	1993-05-20	-
1	1000	yes	SEWING	-	An early version of this notion was Whitcomb Judson's "clasp locker\"	a zipper	1993-05-20	-
1	100	no	WORD ORIGINS	-	Not surprisingly, the word koala comes from a native language of this continent	Australia	1993-05-20	-
1	200	no	WORD ORIGINS	-	This word meaning something not fully understood is from the Greek musterion, "secret rite\"	mystery	1993-05-20	-
1	300	no	WORD ORIGINS	-	The name of this 2- or 3-toed mammal comes from Middle English for "slow\"	a sloth	1993-05-20	-
1	400	no	WORD ORIGINS	-	This title of prince Siddhartha comes from Sanskrit for "awakening\"	Buddha	1993-05-20	-
1	500	no	WORD ORIGINS	-	Lepos, meaning "scale", gave us this word for a pariah	leper	1993-05-20	-
2	200	no	ARCHAEOLOGY	-	Schliemann felt this city's 2nd settlement was the one of Homer's epics; now it seems to be the 7th	Troy	1993-05-20	-
2	400	no	ARCHAEOLOGY	-	Cire perdue or "lost wax", a process of casting figures, was developed during this age	the Bronze Age	1993-05-20	-
2	600	no	ARCHAEOLOGY	-	Common dating techniques are carbon-14, counting tree rings & analyzing grains of this	pollen	1993-05-20	-
2	800	no	ARCHAEOLOGY	-	This term covers anything made by man, from a needle to a pyramid	artifact	1993-05-20	-
2	1000	no	ARCHAEOLOGY	-	Sir Leonard Woolley is known for his excavations of this Sumerian city with a very short name	Ur	1993-05-20	-
2	200	no	U.S. HISTORY	-	In 1885 the Post Office began this service that sent mail more quickly for an extra fee	special delivery	1993-05-20	-
2	400	no	U.S. HISTORY	-	In 1913 the 16th Amendment was ratified, authorizing a tax on this	income	1993-05-20	-
2	600	no	U.S. HISTORY	-	In 1790 Philadelphia replaced this city as the new capital of the U.S.	New York City	1993-05-20	-
2	800	no	U.S. HISTORY	-	During an 1832 expedition, Lake Itasca was discovered to be the source of this river	the Mississippi	1993-05-20	-
2	2000	yes	U.S. HISTORY	-	2 of the 4 men upon whom the new rank of 5-star general was conferred in 1944	(2 of) MacArthur, Eisenhower, Marshall, Hap Arnold	1993-05-20	-
2	200	no	WOMEN AUTHORS	-	Susan Strasberg tells about her friendship with this woman in her book "Marilyn and Me\"	Marilyn Monroe	1993-05-20	-
2	400	no	WOMEN AUTHORS	-	After writing about "Hollywood Wives", she turned her eye on "Hollywood Husbands\"	Jackie Collins	1993-05-20	-
2	600	no	WOMEN AUTHORS	-	\"The Tale of the Body Thief" is this author's fourth & latest novel about the vampire Lestat	Anne Rice	1993-05-20	-
2	800	no	WOMEN AUTHORS	-	From 1949-1956 this "Princess Daisy" author was a fashion editor for Good Housekeeping	Judith Krantz	1993-05-20	-
2	1000	no	WOMEN AUTHORS	-	On a 1987 trip to China, this author of "The Joy Luck Club" met 2 of her half-sisters for the first time	Amy Tan	1993-05-20	-
2	200	no	BROADWAY MUSICALS	-	Dogpatch is almost hit by an atom bomb in this 1956 musical	Li'l Abner	1993-05-20	-
2	400	no	BROADWAY MUSICALS	-	In 1952 Cloris Leachman briefly starred as Ensign Nellie Forbush in this musical	South Pacific	1993-05-20	-
2	600	no	BROADWAY MUSICALS	-	The musical revue "Five Guys Named" this was inspired by jazzman Louis Jordan, not by the 3 Stooges	Moe	1993-05-20	-
2	800	no	BROADWAY MUSICALS	-	\"Un Violon sur le Toit" was a French version of this Broadway smash	Fiddler on the Roof	1993-05-20	-
2	1000	no	BROADWAY MUSICALS	-	Michael J. Pollard played teenager Hugo Peabody in this musical about a rock star who gets drafted	Bye Bye Birdie	1993-05-20	-
2	400	no	SWAZILAND	-	As in Hawaii, sugarcane & this tropical fruit are major exports	pineapple	1993-05-20	-
2	600	no	SWAZILAND	-	At 6,704 square miles, Swaziland is slightly smaller than this "garden state\"	New Jersey	1993-05-20	-
2	800	no	SWAZILAND	-	As a result of this war, Swaziland was under British control from 1903-1968	the Boer War	1993-05-20	-
2	1000	no	SWAZILAND	-	Landlocked, Swaziland is surrounded by Mozambique on 1 side & this country on the other 3	South Africa	1993-05-20	-
2	200	no	MEN OF LETTER	(Alex: In each case, I will give you the clue; the response is the name of an individual, a man, who has an initial. We want that letter in his name.)	He's credited with establishing the world's largest fingerprint file	J. Edgar Hoover	1993-05-20	-
2	400	no	MEN OF LETTER	(Alex: In each case, I will give you the clue; the response is the name of an individual, a man, who has an initial. We want that letter in his name.)	For directing the Watergate burglary, he got a sentence of 2 1/2 to 8 years but served only 32 months	E. Howard Hunt	1993-05-20	-
2	600	no	MEN OF LETTER	(Alex: In each case, I will give you the clue; the response is the name of an individual, a man, who has an initial. We want that letter in his name.)	In 1957 he was named Burma's permanent representative to the U.N.	U Thant	1993-05-20	-
2	3000	yes	MEN OF LETTER	(Alex: In each case, I will give you the clue; the response is the name of an individual, a man, who has an initial. We want that letter in his name.)	His rescue of 2 EDS employees from a prison in Iran was the subject of Ken Follett's "On Wings of Eagles\"	H. Ross Perot	1993-05-20	-
2	1000	no	MEN OF LETTER	(Alex: In each case, I will give you the clue; the response is the name of an individual, a man, who has an initial. We want that letter in his name.)	This lawyer once said, "criminal law has made me a rebel by profession\"	F. Lee Bailey	1993-05-20	-
3	0	no	HISTORIC NAMES	-	In 1529 this Spaniard was made Marques del Valle de Oaxaca	Hernán Cortés	1993-05-20	-
1	100	no	MEXICO	-	This resort city is famous for the cliff divers of La Quebrada	Acapulco	1993-05-21	-
1	200	no	MEXICO	-	Bohemia, Superior & Dos Equis are brands of this produced in Mexico	beer	1993-05-21	-
1	300	no	MEXICO	-	This 760-mile-long peninsula forms the western border of the Gulf of California	the Baja	1993-05-21	-
1	400	no	MEXICO	-	Though Victor Hugo & Garibaldi petitioned to save this emperor's life, he was executed in 1867	Maximilian	1993-05-21	-
1	500	no	MEXICO	-	Every December 12, Mexicans converge on a basilica in Mexico City to honor the virgin of this place	Guadalupe	1993-05-21	-
1	100	no	TV TRIVIA	-	Kurt Russell's father, Bing Russell, played a deputy sheriff on this series set on the Ponderosa	Bonanza	1993-05-21	-
1	200	no	TV TRIVIA	-	Lee Majors not only starred in this series, he sang its theme song, "The Unknown Stuntman\"	The Fall Guy	1993-05-21	-
1	300	no	TV TRIVIA	-	Of all Mr. Newhart's TV series, this one has the shortest name	Bob	1993-05-21	-
1	400	no	TV TRIVIA	-	On "The Addams Family", she played Morticia & Morticia's sister Ophelia	Carolyn Jones	1993-05-21	-
1	500	no	TV TRIVIA	-	Now a sales rep, Larry Mazzeo used the name Larry Mathews when he played Ritchie on this TV series	The Dick Van Dyke Show	1993-05-21	-
1	100	no	MONEY SUPERSTITIONS	-	When you give one of these to a man, a coin or bill should be in it so he'll never be out of money	a wallet	1993-05-21	-
1	200	no	MONEY SUPERSTITIONS	-	If your left hand does this, money is coming	itches	1993-05-21	-
1	300	no	MONEY SUPERSTITIONS	-	A groom may give a bride a penny to wear in this for good luck	a shoe	1993-05-21	-
1	400	no	MONEY SUPERSTITIONS	-	Turn over a silver coin in your pocket when you see this heavenly body & your wish will come true	the Moon	1993-05-21	-
1	500	no	MONEY SUPERSTITIONS	-	Carrying a coin with this year stamped on it is supposed to bring you good luck	the year of your birth	1993-05-21	-
1	100	no	BUGS	-	This bug has been called a "hundred-legger\"	a centipede	1993-05-21	-
1	200	no	BUGS	-	The field & house types of this chirping insect are raised & sold as fish bait	crickets	1993-05-21	-
1	300	no	BUGS	-	Types of this bug transmit Rocky Mountain spotted fever	a tick	1993-05-21	-
1	400	no	BUGS	-	The smallest of these insects is the pygmy locust at less than 1/2 inch in length	a grasshopper	1993-05-21	-
1	500	no	BUGS	-	This North American spider is distinguished by a violin-shaped mark on its back	the brown recluse spider	1993-05-21	-
1	100	no	MEDALS & DECORATIONS	-	In 1882 the emperor of this country established the Order of the Double Dragon for foreigners	China	1993-05-21	-
1	300	no	MEDALS & DECORATIONS	-	There are Army, Navy & Air Force versions of this highest U.S. medal	the Congressional Medal of Honor	1993-05-21	-
1	400	no	MEDALS & DECORATIONS	-	This country established an Independence Medal in 1924, throwing out the old Ottoman Empire Orders	Turkey	1993-05-21	-
1	500	no	MEDALS & DECORATIONS	-	Great services to this country are rewarded with the Order of Henry the Navigator	Portugal	1993-05-21	-
1	100	no	PROVERBS	-	\"All things come to him who" does this	waits	1993-05-21	-
1	200	no	PROVERBS	-	This type of "fruit is sweet" or "sweetest\"	forbidden	1993-05-21	-
1	300	no	PROVERBS	-	In "The Tempest", Shakespeare wrote, "Misery acquaints a man with strange" ones of these	bedfellows	1993-05-21	-
1	400	no	PROVERBS	-	On this holiday "all the birds of the air in couples do join\"	Valentine's Day	1993-05-21	-
1	500	no	PROVERBS	-	According to Ovid, "To be loved" you have to be this	lovable	1993-05-21	-
2	200	no	WORLD HISTORY	-	In 1963 this former British P.M. became an honorary citizen of the U.S. by an act of Congress	Winston Churchill	1993-05-21	-
2	400	no	WORLD HISTORY	-	He was the first president of Gran Colombia; after all , he helped liberate it	Simón Bolívar	1993-05-21	-
2	600	no	WORLD HISTORY	-	This French king was condemned in mid-January 1793 & was executed January 21	Louis XVI	1993-05-21	-
2	800	no	WORLD HISTORY	-	On June 16, 1963 she blasted into orbit, joining Valery Bykovsky who had been launched 2 days earlier	(Valentina) Tereshkova	1993-05-21	-
2	1000	no	WORLD HISTORY	-	Alsace-Lorraine was annexed by Germany as a result of this 1870-71 war	the Franco-Prussian War	1993-05-21	-
2	200	no	MYTHOLOGY	-	Castor, Pollux & Theseus accompanied Jason on his journey aboard this ship	the Argo	1993-05-21	-
2	400	no	MYTHOLOGY	-	He was condemned to support the heavens after supporting Cronus' war against the Olympians	Atlas	1993-05-21	-
2	600	no	MYTHOLOGY	-	Some poets described this dog as having 50 heads, but he's usually shown with 3	Cerberus	1993-05-21	-
2	800	no	MYTHOLOGY	-	In her sanctuary in the Forum, she was not represented by a statue but by a flame tended by virgin priestesses	Vesta	1993-05-21	-
2	1000	no	MYTHOLOGY	-	Troy could not fall while it contained the Palladium, an image of this goddess	Athena	1993-05-21	-
2	200	no	U.S. STATES	-	The world's most powerful solar telescope is near Tucson in this state	Arizona	1993-05-21	-
2	400	no	U.S. STATES	-	An 1867 flood in this state allowed a steamboat to travel down Chattanooga's Main Street	Tennessee	1993-05-21	-
2	600	no	U.S. STATES	-	In 1992 most of this state's permanent residents got $915.84 from its oil revenues	Alaska	1993-05-21	-
2	800	no	U.S. STATES	-	This state has a Lake Sidney Lanier about 25 miles north of Stone Mountain	Georgia	1993-05-21	-
2	1500	yes	U.S. STATES	-	In 1777 New Connecticut changed its name to this, the name the state's still known by	Vermont	1993-05-21	-
2	200	no	PIRATES	-	Although most of these featured a skull & crossbones, some had flaming swords or hourglasses	pirate flags (or the jolly roger)	1993-05-21	-
2	400	no	PIRATES	-	Several pirates of the Indian Ocean, including William Kidd, used this large island off the African coast as a haven	Madagascar	1993-05-21	-
2	600	no	PIRATES	-	One of the many weapons used by pirates was this short, slightly curved sword with a single cutting edge	the cutlass	1993-05-21	-
2	800	no	PIRATES	-	It's the term pirates used for the land along the Caribbean coast of South America	the Spanish Main	1993-05-21	-
2	1000	no	PIRATES	-	These Mediterranean pirates were based in Algiers, Tunis & Tripoli	the Barbary pirates	1993-05-21	-
2	200	no	SCIENCE	-	An astroblame is a scar on the Earth's surface caused by one of these	a meteor	1993-05-21	-
2	400	no	SCIENCE	-	These warm, dry winds can raise the temperature at the base of the Rockies as much as 40º F. in 1 hour	the Chinooks	1993-05-21	-
2	1000	yes	SCIENCE	-	From the Latin for "body", it's a free-moving cell such as an erythrocyte or leukocyte	a corpuscle	1993-05-21	-
2	800	no	SCIENCE	-	In the 2nd U.S. suborbital flight, his Mercury capsule, Liberty Bell 7, sank in the Atlantic upon splashdown	Gus Grissom	1993-05-21	-
2	1000	no	SCIENCE	-	2 isotopes of the same element differ in the number of these subatomic particles	neutrons	1993-05-21	-
2	200	no	COMPOSERS	-	Shortly before his death, this "Nutcracker" composer received an hon. doctorate from Cambridge Univ.	Tchaikovsky	1993-05-21	-
2	400	no	COMPOSERS	-	In addition to marches, he composed an orchestral piece inspired by the novel "Ben-Hur\"	Sousa	1993-05-21	-
2	600	no	COMPOSERS	-	His "Bolero" had its American debut at a 1929 concert of the N.Y. Philharmonic-Symphony	Ravel	1993-05-21	-
2	800	no	COMPOSERS	-	A 1791 Handel music festival inspired him to compose the oratorio "The Creation\"	Haydn	1993-05-21	-
2	1000	no	COMPOSERS	-	Early in his career, Igor Stravinsky was tutored by this "Flight of the Bumblebee" composer	Rimsky-Korsakov	1993-05-21	-
3	0	no	POETRY	-	The woman with the most quotes in the new edition of Bartlett's Familiar Quotations is this American	Emily Dickinson	1993-05-21	-
1	100	no	SICKNESS & HEALTH	-	Using the waxed or unwaxed type of this at least once a day helps prevent gingivitis	dental floss	1993-05-27	-
1	200	no	SICKNESS & HEALTH	-	This form of dermatitis is named for a baby garment	diaper rash	1993-05-27	-
1	300	no	SICKNESS & HEALTH	-	Legionnaire's Disease affects the bronchial tubes & this pair of organs	the lungs	1993-05-27	-
1	400	no	SICKNESS & HEALTH	-	Singultus is the less common name for this type of diaphragmatic spasm	hiccups	1993-05-27	-
1	500	no	SICKNESS & HEALTH	-	Prolonged exposure to toxic chemicals may cause the aplastic type of this condition	anemia	1993-05-27	-
1	100	no	EUROPEAN CUISINE	-	Galette des Rois is a special cake created for Twelfth Night festivities in this country	France	1993-05-27	-
1	200	no	EUROPEAN CUISINE	-	Carbonnade is a Belgian beef stew made with this alcoholic brew	beer	1993-05-27	-
1	300	no	EUROPEAN CUISINE	-	Legend says Veal Oscar was named for this Scandinavian country's King Oscar II, who liked to eat it	Sweden	1993-05-27	-
1	400	no	EUROPEAN CUISINE	-	The delicate pasta Italians call Capelli d' angelo, we know by this name	angel hair pasta	1993-05-27	-
1	500	no	EUROPEAN CUISINE	-	Kourabiedes are buttery cookies served on special occasions in this country	Greece	1993-05-27	-
1	100	no	QUOTES	-	Mark Twain said, "Everyone is" one of these heavenly bodies "and has a dark side which he never shows\"	a moon	1993-05-27	-
1	200	no	QUOTES	-	A famous quote about suckers says they're born this often	every minute	1993-05-27	-
1	300	no	QUOTES	-	Prime minister who said in 1941, "Never give in, never give in, never, never, never, never\"	Winston Churchill	1993-05-27	-
1	400	no	QUOTES	-	The most famous quote from "1984" is undoubtedly "Big Brother is" doing this	watching you	1993-05-27	-
1	500	no	QUOTES	-	This author wrote of "making the world safe for hypocrisy" in "Look Homeward, Angel\"	Thomas Wolfe	1993-05-27	-
1	100	no	1893	-	U.S. interests deposed Queen Liliuokalani of this kingdom, paving the way for its annexation	Hawaii	1993-05-27	-
1	200	no	1893	-	More than 100,000 rushed to the Cherokee Strip area of this territory to claim land	Oklahoma	1993-05-27	-
1	300	no	1893	-	Lord Stanley of Preston gave a trophy to be awarded to the best Canadian team in this sport	hockey	1993-05-27	-
1	400	no	1893	-	Laos was added to this French Southeast Asian dependency	Indochina	1993-05-27	-
1	500	no	1893	-	This state's governor, John Peter Altgeld, pardoned the 3 surviving Haymarket Riot conspirators	Illinois	1993-05-27	-
1	100	no	WORLD FACTS	-	While kids in the U.S. have to learn 26 of these, kids in Cambodia have to learn 72	letters of the alphabet	1993-05-27	-
1	200	no	WORLD FACTS	-	This country's Kathmandu Valley was once home to 3 principalities	Nepal	1993-05-27	-
1	300	no	WORLD FACTS	-	The 1494 line that split South America between Spain & Portugal also split this north Atlantic island	Greenland	1993-05-27	-
1	400	no	WORLD FACTS	-	This country's flag has a yin-yang symbol & 4 trigrams for earth, air, fire & water	South Korea	1993-05-27	-
1	800	yes	WORLD FACTS	-	By a 127-6 vote, the U.N. expelled this country September 22, 1992	Yugoslavia	1993-05-27	-
1	100	no	TV "O"s	-	He played florist, er...Father Murphy	(Merlin) Olsen	1993-05-27	-
1	200	no	TV "O"s	-	In the mid-'70s he could be found singing between Telma Hopkins & Joyce Vincent Wilson	Tony Orlando	1993-05-27	-
1	300	no	TV "O"s	-	This Lord won Emmys in 1960, 1973, 1975, 1982 & 1984	Lord Olivier	1993-05-27	-
1	400	no	TV "O"s	-	This "thirtysomething" star directed the 1992 TV movie "Doing Time on Maple Drive\"	Ken Olin	1993-05-27	-
1	500	no	TV "O"s	-	Lt. Castillo on "Miami Vice", he helped clean up L.A. after the 1992 riots	(Edward James) Olmos	1993-05-27	-
2	200	no	U.S. CITIES	-	Part of the metropolitan area of this Nebraska city extends into Council Bluffs, Iowa	Omaha	1993-05-27	-
2	400	no	U.S. CITIES	-	This university city on San Francisco Bay was named for an early 18th century Anglican bishop	Berkeley	1993-05-27	-
2	600	no	U.S. CITIES	-	The Cuyahoga River divides this Ohio city into an east side & a west side	Cleveland	1993-05-27	-
2	800	no	U.S. CITIES	-	A Michigan city is named for this Ottawa chief who fought the British in the French & Indian War	Pontiac	1993-05-27	-
2	1000	no	U.S. CITIES	-	Explorer George Rogers Clark is buried in this largest Kentucky city, which he helped found in 1778	Louisville	1993-05-27	-
2	200	no	NOTABLE WOMEN	-	Elizabeth Gurley Flynn was a founding member of this organization abbreviated ACLU	American Civil Liberties Union	1993-05-27	-
2	400	no	NOTABLE WOMEN	-	From 1970 to 1974 she was Secretary of State for Education & Science under PM Edward Heath	Margaret Thatcher	1993-05-27	-
2	200	no	BROADWAY MUSICALS	-	The score of "George M!" features many of the songs he wrote, including "Mary's A Grand Old Name\"	George M. Cohan	1993-05-27	-
2	400	no	BROADWAY MUSICALS	-	In Germany this musical is known as "Der Mann von La Mancha\"	The Man of La Mancha	1993-05-27	-
2	600	no	BROADWAY MUSICALS	-	She starred on Broadway in "Fanny" in 1954, 15 years before she began mothering "The Brady Bunch\"	Florence Henderson	1993-05-27	-
2	500	yes	BROADWAY MUSICALS	-	\"The Unsinkable Molly Brown" was Meredith Wilson's second musical, this was his first	The Music Man	1993-05-27	-
2	1000	no	BROADWAY MUSICALS	-	This 1960 show about a legendary king was the last musical directed by Moss Hart	Camelot	1993-05-27	-
2	200	no	NAVAL BATTLES	-	A 400-ship Roman fleet led by Octavian & Agrippa defeated the fleets of these 2 lovers at Actium in 31 B.C.	Antony & Cleopatra	1993-05-27	-
2	400	no	NAVAL BATTLES	-	Sir Francis Drake was second in command when the British defeated this fleet in 1588	the Spanish Armada	1993-05-27	-
2	600	no	NAVAL BATTLES	-	In this 1805 battle near Cadiz, Spain, no British ships were lost, but Napoleon lost about 20	Trafalgar	1993-05-27	-
2	800	no	NAVAL BATTLES	-	Russia used the first ship-to-ship explosive shells in 1853, during this war	the Crimean War	1993-05-27	-
2	1000	no	NAVAL BATTLES	-	In May 1942 the U.S. & Japan fought the first all-air naval battle in this sea off Australia	the Coral Sea	1993-05-27	-
2	200	no	ESSAYS	-	This Thoreau essay was originally titled "Resistance to Civil Government\"	\"Uncivil Disobedience\"	1993-05-27	-
