round	value	daily_double	category	comments	answer	question	air_date	notes
1	300	no	AFRICAN HISTORY	-	The ruins of this city destroyed by Rome in 146 B.C. are a 20-minute drive from Tunis, Tunisia	Carthage	1992-11-11	1992 Tournament of Champions quarterfinal game 3.
1	400	no	AFRICAN HISTORY	-	Sadiq Al-Mahdi, great-grandson of the Mahdi, led this largest African country from 1986-1989	The Sudan	1992-11-11	1992 Tournament of Champions quarterfinal game 3.
1	700	yes	AFRICAN HISTORY	-	In 1963 Ahmed Ben Bella became the first president of this north African country	Algeria	1992-11-11	1992 Tournament of Champions quarterfinal game 3.
1	100	no	HODGEPODGE	-	Gordon Carruth reports that in 1811 a Mrs. Andrews in New York City gave instructions on painting on this plush fabric	Velvet	1992-11-11	1992 Tournament of Champions quarterfinal game 3.
1	200	no	HODGEPODGE	-	In a standard set of dominoes, the tiles range from double blank to this double number	6	1992-11-11	1992 Tournament of Champions quarterfinal game 3.
1	300	no	HODGEPODGE	-	On his death in 1976 he left his museum $725 million dollars	J. Paul Getty	1992-11-11	1992 Tournament of Champions quarterfinal game 3.
1	400	no	HODGEPODGE	-	Steve Brodie leaped onto the front pages when he leaped from this into the East River, July 23, 1886	The Brooklyn Bridge	1992-11-11	1992 Tournament of Champions quarterfinal game 3.
1	500	no	HODGEPODGE	-	The 2 styles most commonly used by high-jumpers are the forward, or straddle, & the backward, called this	The Fosbury Flop	1992-11-11	1992 Tournament of Champions quarterfinal game 3.
1	100	no	\"C" YOU AT THE MOVIES	-	Ann Sheridan & Hedy Lamarr were considered for the role of Ilsa in this 1942 classic	\"Casablanca\"	1992-11-11	1992 Tournament of Champions quarterfinal game 3.
1	200	no	\"C" YOU AT THE MOVIES	-	The ad line for this Greta Garbo & Robert Taylor film could have been "Garbo Coughs\"	\"Camille\"	1992-11-11	1992 Tournament of Champions quarterfinal game 3.
1	300	no	\"C" YOU AT THE MOVIES	-	Billy Crystal said he stopped eating veal after performing with a calf in this film about a cattle drive	\"City Slickers\"	1992-11-11	1992 Tournament of Champions quarterfinal game 3.
1	400	no	\"C" YOU AT THE MOVIES	-	Leonard Maltin called this Daryl Hannah film "the world's first feminist caveman movie\"	\"Clan of the Cave Bear\"	1992-11-11	1992 Tournament of Champions quarterfinal game 3.
1	500	no	\"C" YOU AT THE MOVIES	-	This comedy-western was Nat King Cole's last film; Jane Fonda, not Nat, played the title role	\"Cat Ballou\"	1992-11-11	1992 Tournament of Champions quarterfinal game 3.
2	200	no	BIOGRAPHIES	-	\"Equal Justice" is an aptly-titled biography of this first woman to sit on the Supreme Court	Sandra Day O' Connor	1992-11-11	1992 Tournament of Champions quarterfinal game 3.
2	400	no	BIOGRAPHIES	-	He's the subject of Edvard Radzinsky's best seller "The Last Czar\"	Nicholas II	1992-11-11	1992 Tournament of Champions quarterfinal game 3.
2	600	no	BIOGRAPHIES	-	\"Beauty and the Traitor" suggests that this general's wife ignited the spark of treason in him	Benedict Arnold	1992-11-11	1992 Tournament of Champions quarterfinal game 3.
2	800	no	BIOGRAPHIES	-	Kenneth Silverman won a 1985 Pulitzer Prize for his "Life and Times of" this Puritan preacher	Cotton Mather	1992-11-11	1992 Tournament of Champions quarterfinal game 3.
2	1000	no	BIOGRAPHIES	-	\"Bitter Fame", a controversial 1989 biography, deals with this poet, her suffering & breakdown	Sylvia Plath	1992-11-11	1992 Tournament of Champions quarterfinal game 3.
2	200	no	HISTORIC HOMES	-	His cousin's Old Kentucky Home, Federal Hill, is said to have inspired his famous song	Stephen Foster	1992-11-11	1992 Tournament of Champions quarterfinal game 3.
2	400	no	HISTORIC HOMES	-	The oldest brick house in the town of Amherst was built by this poet's grandfather in 1813	Emily Dickinson	1992-11-11	1992 Tournament of Champions quarterfinal game 3.
2	600	no	HISTORIC HOMES	-	This frontier hero's reconstructed log cabin now stands on the grounds of a Tennessee high school	Davy Crockett	1992-11-11	1992 Tournament of Champions quarterfinal game 3.
2	100	yes	HISTORIC HOMES	-	Her home in Rochester, New York is now a museum filled with memorabilia of the fight for equal rights	Susan B. Anthony	1992-11-11	1992 Tournament of Champions quarterfinal game 3.
2	1000	no	HISTORIC HOMES	-	Chesterwood, a Stockbridge, MA estate, includes the home & studio of this "Minuteman" sculptor	Daniel Chester French	1992-11-11	1992 Tournament of Champions quarterfinal game 3.
2	200	no	HALOGENS	-	A tincture of this halogen is used as an antiseptic on cuts & scratches	Iodine	1992-11-11	1992 Tournament of Champions quarterfinal game 3.
2	400	no	HALOGENS	-	It's added to swimming pools & is a part of laundry bleaches	Chlorine	1992-11-11	1992 Tournament of Champions quarterfinal game 3.
2	600	no	HALOGENS	-	Astatine is the only halogen whose isotopes are all this, which is why they have half-lives	radioactive	1992-11-11	1992 Tournament of Champions quarterfinal game 3.
2	800	no	HALOGENS	-	As its name suggests, a halogen reacts with metals to make these	Halides/Salts	1992-11-11	1992 Tournament of Champions quarterfinal game 3.
2	1000	no	HALOGENS	-	It takes about 15,000 tons of seawater to get one ton of this reddish-brown liquid used in sedatives	bromine	1992-11-11	1992 Tournament of Champions quarterfinal game 3.
2	200	no	FAMOUS WOMEN	-	In 1989 Barbara Harris became the first woman in the history of the Episcopal Church to be made this	bishop	1992-11-11	1992 Tournament of Champions quarterfinal game 3.
2	400	no	FAMOUS WOMEN	-	It's the name under which Judith Martin writes her famous etiquette column	\"Miss Manners\"	1992-11-11	1992 Tournament of Champions quarterfinal game 3.
2	600	no	FAMOUS WOMEN	-	After she was beaten up by the woman owner of a Montana bar, this crusader never used her hatchet again	Carrie Nation	1992-11-11	1992 Tournament of Champions quarterfinal game 3.
2	800	no	FAMOUS WOMEN	-	When she became transportation secretary in 1983, she was only the seventh woman to head a cabinet department	Elizabeth Dole	1992-11-11	1992 Tournament of Champions quarterfinal game 3.
2	1000	no	FAMOUS WOMEN	-	In 1973 this Impressionist painter was named to the National Women's Hall of Fame	Mary Cassatt	1992-11-11	1992 Tournament of Champions quarterfinal game 3.
2	200	no	SHAKESPEARE	-	Brutus tells him, "You shall not in your funeral speech blame us, but speak all good you can devise\"	Marc Antony	1992-11-11	1992 Tournament of Champions quarterfinal game 3.
2	400	no	SHAKESPEARE	-	This "Merchant of Venice" heiress has many suitors, including the Duke of Saxony's nephew	Portia	1992-11-11	1992 Tournament of Champions quarterfinal game 3.
2	1000	yes	SHAKESPEARE	-	In Scene I of this play, the title monarch announces, "Know that we have divided in three our kingdom\"	King Lear	1992-11-11	1992 Tournament of Champions quarterfinal game 3.
2	800	no	SHAKESPEARE	-	At the end of "Hamlet", this Norwegian prince arrives to claim the Danish throne	Fortinbras	1992-11-11	1992 Tournament of Champions quarterfinal game 3.
2	1000	no	SHAKESPEARE	-	Helicanus & Escanes are two lords of this city; Pericles is prince of it	Tyre	1992-11-11	1992 Tournament of Champions quarterfinal game 3.
2	200	no	THE IROQUOIS	-	Squash & these 2 succotash ingredients were the "Three Sisters" of Iroquois agriculture	Corn & Lima Beans	1992-11-11	1992 Tournament of Champions quarterfinal game 3.
2	400	no	THE IROQUOIS	-	An Iroquois woman could do this to her husband simply by putting his belongings outdoors	divorce him	1992-11-11	1992 Tournament of Champions quarterfinal game 3.
2	600	no	THE IROQUOIS	-	Traditionally, the Iroquois League was founded by Dekanawidah & this chief whose name Longfellow borrowed	Hiawatha	1992-11-11	1992 Tournament of Champions quarterfinal game 3.
2	800	no	THE IROQUOIS	-	The Tuscarora joined the Iroquois League in 1722, increasing the number of members to this	6	1992-11-11	1992 Tournament of Champions quarterfinal game 3.
2	1000	no	THE IROQUOIS	-	The Iroquois' name for themselves, Haudenosaunee, refers to these, their famous dwellings	The Long Houses	1992-11-11	1992 Tournament of Champions quarterfinal game 3.
3	0	no	VICE PRESIDENTS	-	He served as vice president for the shortest length of time: one month	John Tyler	1992-11-11	1992 Tournament of Champions quarterfinal game 3.
1	100	no	ANIMALS	-	Like its giant relative, the lesser variety of this is also a bamboo eater	the panda	1992-11-12	1992 Tournament of Champions quarterfinal game 4.
1	200	no	ANIMALS	-	The Macropus rufus, it can lean back on its tail to free its hind feet for use as weapons	the kangaroo	1992-11-12	1992 Tournament of Champions quarterfinal game 4.
1	300	no	ANIMALS	-	A few of these large bovines still exist in the wild in Tibet at elevations over 14,000 feet	yaks	1992-11-12	1992 Tournament of Champions quarterfinal game 4.
1	400	no	ANIMALS	-	An elephant has 5 toes on a front foot & a camel has this many	2	1992-11-12	1992 Tournament of Champions quarterfinal game 4.
1	500	no	ANIMALS	-	They're the tallest North American birds	the whooping crane	1992-11-12	1992 Tournament of Champions quarterfinal game 4.
1	100	no	LACROSSE	-	To make up a men's lacrosse team, you need this many people, one more than a baseball team	10	1992-11-12	1992 Tournament of Champions quarterfinal game 4.
1	200	no	LACROSSE	-	Lacrosse was played for medals just twice in these games, in 1904 & 1908	the Olympics	1992-11-12	1992 Tournament of Champions quarterfinal game 4.
1	300	no	LACROSSE	-	Each half each team is allowed 2 2-minute ones of these	a time-out	1992-11-12	1992 Tournament of Champions quarterfinal game 4.
1	400	no	LACROSSE	-	As in hockey, each period begins with one of these	a face-off	1992-11-12	1992 Tournament of Champions quarterfinal game 4.
1	500	no	LACROSSE	-	The sport was named & developed in what's now this country, where it's a national game	Canada	1992-11-12	1992 Tournament of Champions quarterfinal game 4.
1	100	no	BROADWAY	-	Mac Davis had to learn how to twirl a rope before he took over the role of this cowboy humorist in 1992	Will Rogers	1992-11-12	1992 Tournament of Champions quarterfinal game 4.
1	200	no	BROADWAY	-	Lots of people took taxis to see this "Taxi" star in "Conversations with My Father\"	Judd Hirsch	1992-11-12	1992 Tournament of Champions quarterfinal game 4.
1	300	no	BROADWAY	-	\"Six Degrees of Separation" was inspired by a man who passed himself off as this actor's son	Sidney Poitier	1992-11-12	1992 Tournament of Champions quarterfinal game 4.
1	400	no	BROADWAY	-	In 1991 Cyd Charisse made her Broadway debut as the ballerina in this musical set in Germany	Grand Hotel	1992-11-12	1992 Tournament of Champions quarterfinal game 4.
1	500	no	BROADWAY	-	She not only hosted the Tony Awards in 1992, she won one for "Death and the Maiden\"	Glenn Close	1992-11-12	1992 Tournament of Champions quarterfinal game 4.
1	100	no	PEOPLE	-	In the last week of July 1992, 3 books about this woman were on "The New York Times" best-seller list	Princess Di	1992-11-12	1992 Tournament of Champions quarterfinal game 4.
1	200	no	PEOPLE	-	She had never held public office before she was elected governor of Alabama in 1966	Lurleen Wallace	1992-11-12	1992 Tournament of Champions quarterfinal game 4.
1	300	no	PEOPLE	-	Famed for his coverage of the Gulf War, this CNN correspondent was born in New Zealand in 1934	Peter Arnett	1992-11-12	1992 Tournament of Champions quarterfinal game 4.
1	400	no	PEOPLE	-	This showbiz agent is famous for throwing star-studded parties at Spago on Oscar night—think  "fast\"	\"Swifty" Lazar	1992-11-12	1992 Tournament of Champions quarterfinal game 4.
1	500	yes	PEOPLE	-	Dian Fossey was murdered in this country in 1985	Rwanda	1992-11-12	1992 Tournament of Champions quarterfinal game 4.
1	100	no	AWARDS	-	In 1991 this Soviet leader won the Martin Luther King, Jr. Non-Violent Peace Prize	Gorbachev	1992-11-12	1992 Tournament of Champions quarterfinal game 4.
1	200	no	AWARDS	-	\"The Best Intentions" was the 1992 winner of the Golden Palm, the top prize at this film festival	Cannes	1992-11-12	1992 Tournament of Champions quarterfinal game 4.
1	300	no	AWARDS	-	Gavel Awards & Pro-Bono Publico Awards are given annually by this legal organization	the American Bar Association	1992-11-12	1992 Tournament of Champions quarterfinal game 4.
1	400	no	AWARDS	-	Though the Patty Berg Award was established in this sport in 1979, Patty Berg didn't win it until 1989	golf	1992-11-12	1992 Tournament of Champions quarterfinal game 4.
1	500	no	AWARDS	-	In 1947 this university was given a special citation for its high standards in governing the Pulitzer Prizes	Columbia	1992-11-12	1992 Tournament of Champions quarterfinal game 4.
1	100	no	15-LETTER WORDS	-	This personality conflict between husbands & wives is grounds for divorce in some states	incompatibility	1992-11-12	1992 Tournament of Champions quarterfinal game 4.
1	200	no	15-LETTER WORDS	-	It's the process of removing radioactive material from a body	decontaminating	1992-11-12	1992 Tournament of Champions quarterfinal game 4.
1	300	no	15-LETTER WORDS	-	This adjective describes conduct not appropriate for a good ballplayer	unsportsmanlike	1992-11-12	1992 Tournament of Champions quarterfinal game 4.
1	400	no	15-LETTER WORDS	-	This type of rumor lacks a basis in fact	unsubstantiated	1992-11-12	1992 Tournament of Champions quarterfinal game 4.
1	500	no	15-LETTER WORDS	-	It's concern for the welfare of others, frequently shown through philanthropy	humanitarianism	1992-11-12	1992 Tournament of Champions quarterfinal game 4.
2	200	no	SCIENTISTS	-	Pytheas, an ancient Greek geographer, was perhaps the first to associate tidal motion with this body	the Moon	1992-11-12	1992 Tournament of Champions quarterfinal game 4.
2	400	no	SCIENTISTS	-	This proposer of the absolute temperature scale was knighted by Queen Victoria in 1866	Kelvin	1992-11-12	1992 Tournament of Champions quarterfinal game 4.
2	600	no	SCIENTISTS	-	Hugo de Vries, who rediscovered Mendel's laws of heredity, also proposed this theory of altered genes	mutation	1992-11-12	1992 Tournament of Champions quarterfinal game 4.
2	800	no	SCIENTISTS	-	This German astronomer born in 1571 was the first to explain how the planets move around the Sun	Kepler	1992-11-12	1992 Tournament of Champions quarterfinal game 4.
2	1000	no	SCIENTISTS	-	It was American physicist Arthur Compton who came up with this name for a quantum of light	a photon	1992-11-12	1992 Tournament of Champions quarterfinal game 4.
2	200	no	SILENT MOVIE DIRECTORS	-	Most of his profits from "The Birth of a Nation" were lost when he made "Intolerance\"	D.W. Griffith	1992-11-12	1992 Tournament of Champions quarterfinal game 4.
2	400	no	SILENT MOVIE DIRECTORS	-	He directed his last film, "A Countess from Hong Kong", in 1967, over 50 years after his first film	Charlie Chaplin	1992-11-12	1992 Tournament of Champions quarterfinal game 4.
2	600	no	SILENT MOVIE DIRECTORS	-	Although best known for his sound films, William Wellman directed this first "Best Picture" winner	Wings	1992-11-12	1992 Tournament of Champions quarterfinal game 4.
2	800	no	SILENT MOVIE DIRECTORS	-	As an actor, this Vienna-born director was billed as "the man you love to hate\"	Erich von Stroheim	1992-11-12	1992 Tournament of Champions quarterfinal game 4.
2	1000	no	SILENT MOVIE DIRECTORS	-	He remade his first Hollywood film, "The Squaw Man", twice	Cecil B. DeMille	1992-11-12	1992 Tournament of Champions quarterfinal game 4.
2	200	no	ARCHITECTURE	-	This arched brick or stone ceiling can be of the barrel, groin or ribbed style	a vault	1992-11-12	1992 Tournament of Champions quarterfinal game 4.
2	400	no	ARCHITECTURE	-	From the Latin for "porch", it's a structure consisting of a roof supported by columns	a portico	1992-11-12	1992 Tournament of Champions quarterfinal game 4.
2	600	no	ARCHITECTURE	-	Bernini's bronze canopy over the main altar at St. Peter's is a masterpiece of this style of architecture	Baroque	1992-11-12	1992 Tournament of Champions quarterfinal game 4.
2	800	no	ARCHITECTURE	-	Mesopotamians built these temples to look like miniature mountains	ziggurats	1992-11-12	1992 Tournament of Champions quarterfinal game 4.
2	1000	no	ARCHITECTURE	-	This architect, born in 1573, founded the English school of classical architecture	Inigo Jones	1992-11-12	1992 Tournament of Champions quarterfinal game 4.
2	200	no	WRITERS	-	\"Sister Carrie" was Theodore Dreiser's first novel & "Carrie" was this author's	Stephen King	1992-11-12	1992 Tournament of Champions quarterfinal game 4.
2	400	no	WRITERS	-	She sometimes joked that she was writing a sequel to her famous novel, to be titled "Back With the Breeze\"	Margaret Mitchell	1992-11-12	1992 Tournament of Champions quarterfinal game 4.
2	600	no	WRITERS	-	He wrote about Jews in "Exodus", Muslims in "The Haj" & Protestants & Catholics in "Trinity\"	Leon Uris	1992-11-12	1992 Tournament of Champions quarterfinal game 4.
2	800	no	WRITERS	-	Sebastian Melmoth was the name used by this Irish playwright while in exile	Oscar Wilde	1992-11-12	1992 Tournament of Champions quarterfinal game 4.
2	1000	yes	WRITERS	-	Scientific American was one of the magazines that reviewed his novel "Gravity's Rainbow\"	Thomas Pynchon	1992-11-12	1992 Tournament of Champions quarterfinal game 4.
2	200	no	ISLANDS	-	When Columbus reached this future U.S. commonwealth in 1493, he named it San Juan Bautista	Puerto Rico	1992-11-12	1992 Tournament of Champions quarterfinal game 4.
2	400	no	ISLANDS	-	Argentina's claim to this British South Atlantic colony dates back to 1820	the Falklands	1992-11-12	1992 Tournament of Champions quarterfinal game 4.
2	600	no	ISLANDS	-	Quebec's Anticosti Island at the mouth of this river is the site of a provincial park	the St. Lawrence	1992-11-12	1992 Tournament of Champions quarterfinal game 4.
2	800	no	ISLANDS	-	This island off the coast of Southern California was named in honor of St. Catherine of Alexandria	Santa Catalina	1992-11-12	1992 Tournament of Champions quarterfinal game 4.
2	1300	yes	ISLANDS	-	This Caribbean island in the Leeward group has both French & Dutch sections	Saint Martin	1992-11-12	1992 Tournament of Champions quarterfinal game 4.
2	200	no	HISTORIC "G''s	-	Most of England's Hanoverian monarchs had this first name	George	1992-11-12	1992 Tournament of Champions quarterfinal game 4.
2	400	no	HISTORIC "G''s	-	This prominent Monegasque family is descended from wealthy Genoese merchants & politicians	the Grimaldis	1992-11-12	1992 Tournament of Champions quarterfinal game 4.
2	600	no	HISTORIC "G''s	-	The third Swedish king to bear this name was shot at a masquerade & died a few days later	Gustav	1992-11-12	1992 Tournament of Champions quarterfinal game 4.
2	800	no	HISTORIC "G''s	-	This 4-time British prime minister tried to abolish income taxes but failed	Gladstone	1992-11-12	1992 Tournament of Champions quarterfinal game 4.
2	1000	no	HISTORIC "G''s	-	The name of this political faction in Medieval Italy was derived from the Welfs, a German family	the Guelphs	1992-11-12	1992 Tournament of Champions quarterfinal game 4.
3	0	no	POLAND	-	Laid to rest temporarily at Arlington in 1941, his remains were returned to Poland in 1992	Jan Paderewski	1992-11-12	1992 Tournament of Champions quarterfinal game 4.
1	100	no	FAMOUS NAMES	-	H.R. Haldeman served 18 months in federal prison as a result of his part in this scandal	Watergate	1992-11-13	1992 Tournament of Champions quarterfinal game 5.
1	200	no	FAMOUS NAMES	-	Fred Noonan was navigator on the 1937 around-the-world flight on which she disappeared	Amelia Earhart	1992-11-13	1992 Tournament of Champions quarterfinal game 5.
1	300	no	FAMOUS NAMES	-	He became a prince of the U.K. in 1957, some 10 years after he married Elizabeth	Prince Philip	1992-11-13	1992 Tournament of Champions quarterfinal game 5.
1	400	no	FAMOUS NAMES	-	Ira Allen, a brother of Ethan Allen, was a founder of this state's university	Vermont	1992-11-13	1992 Tournament of Champions quarterfinal game 5.
1	500	no	FAMOUS NAMES	-	Douglas MacArthur was a member of the court martial that convicted this advocate of air power in 1925	Billy Mitchell	1992-11-13	1992 Tournament of Champions quarterfinal game 5.
1	100	no	WINE	-	Her picture adorns the label of a red wine called "Marilyn Merlot\"	Marilyn Monroe	1992-11-13	1992 Tournament of Champions quarterfinal game 5.
1	200	no	WINE	-	This term for a wine's bouquet is also a synonym for "snoot\"	nose	1992-11-13	1992 Tournament of Champions quarterfinal game 5.
1	300	no	WINE	-	This word, Italian for "sparkling", is found in the name of a sparkling wine from Asti, Italy	spumante	1992-11-13	1992 Tournament of Champions quarterfinal game 5.
1	400	no	WINE	-	Manzanilla is a dry and somewhat salty type of this fortified Spanish wine	sherry	1992-11-13	1992 Tournament of Champions quarterfinal game 5.
1	500	no	WINE	-	Websters' says this word for a wine steward is derived from old Provencal for "pack animal driver\"	Sommelier	1992-11-13	1992 Tournament of Champions quarterfinal game 5.
1	100	no	MUSEUMS	-	An Ulverston, England museum is devoted to the film careers of this comedy pair who starred in "The Flying Deuces\"	Laurel & Hardy	1992-11-13	1992 Tournament of Champions quarterfinal game 5.
1	200	no	MUSEUMS	-	A collection of the art of this 20th century Spanish painter is housed at the Hotel Sale in Paris	Pablo Picasso	1992-11-13	1992 Tournament of Champions quarterfinal game 5.
1	300	no	MUSEUMS	-	This city's Field Museum of Natural History has a 250,000 volume reference library	Chicago	1992-11-13	1992 Tournament of Champions quarterfinal game 5.
1	400	no	MUSEUMS	-	Austin, TX has a museum devoted to this short-story author of "Cabbages And Kings\"	O. Henry (William Sidney Porter)	1992-11-13	1992 Tournament of Champions quarterfinal game 5.
1	500	no	MUSEUMS	-	The Drake Well Museum in Titusville in this state commemorates the first oil well in the U.S.	Pennsylvania	1992-11-13	1992 Tournament of Champions quarterfinal game 5.
1	100	no	FISH	-	The Pacific type of this fish dies after swimming up rivers to spawn; the Atlantic does not	salmon	1992-11-13	1992 Tournament of Champions quarterfinal game 5.
1	200	no	FISH	-	Some Amazon Indians use the teeth of this fish, also called the caribe, as razor blades	piranha	1992-11-13	1992 Tournament of Champions quarterfinal game 5.
1	300	no	FISH	-	Hippocampus is the scientific name of this odd fish with a prehensile tail	seahorse	1992-11-13	1992 Tournament of Champions quarterfinal game 5.
1	500	yes	FISH	-	This primitive eel-like fish almost caused the extermination of the Great Lakes trout	lamprey	1992-11-13	1992 Tournament of Champions quarterfinal game 5.
1	500	no	FISH	-	Clarias Batrachus, the walking type of this fish, can travel overland from pond-to-pond	catfish	1992-11-13	1992 Tournament of Champions quarterfinal game 5.
1	100	no	GOLDEN GUYS	-	In the 1920s, the company he founded merged with Metro Pictures Corporation	Samuel Goldwyn	1992-11-13	1992 Tournament of Champions quarterfinal game 5.
1	200	no	GOLDEN GUYS	-	After losing to Lyndon Johnson in 1964, he was re-elected to the Senate in 1968	Barry Goldwater	1992-11-13	1992 Tournament of Champions quarterfinal game 5.
1	300	no	GOLDEN GUYS	-	In 1948 Peter Goldmark and his team at CBS introduced this type of record	LP	1992-11-13	1992 Tournament of Champions quarterfinal game 5.
1	400	no	GOLDEN GUYS	-	This comic strip artist was known for creating intricate mechanical devices	Rube Goldberg	1992-11-13	1992 Tournament of Champions quarterfinal game 5.
1	500	no	GOLDEN GUYS	-	His "The Vicar Of Wakefield" might have been published to save himself from going to jail for debt	Oliver Goldsmith	1992-11-13	1992 Tournament of Champions quarterfinal game 5.
1	100	no	ELVIS SONGS	-	\"Everybody in the whole cell block was a' dancin' to" this	The "Jailhouse Rock\"	1992-11-13	1992 Tournament of Champions quarterfinal game 5.
1	200	no	ELVIS SONGS	-	The flip side of "Hound Dog"; it insists "I don't want no other love, baby.  It's just you I'm thinking of.\"	\"Don't Be Cruel\"	1992-11-13	1992 Tournament of Champions quarterfinal game 5.
1	300	no	ELVIS SONGS	-	\"Well, a' bless my soul", this song stayed on the charts for 30 weeks, the longest of any Elvis single	\"All Shook Up\"	1992-11-13	1992 Tournament of Champions quarterfinal game 5.
1	400	no	ELVIS SONGS	-	This "keeps pouring down and up ahead's another town that I'll go walkin' through\"	\"Kentucky Rain\"	1992-11-13	1992 Tournament of Champions quarterfinal game 5.
1	500	no	ELVIS SONGS	-	This No. 1 hit from 1960 contains a spoken passage based on Jack's speech in "As You Like It\"	\"Are You Lonesome Tonight?\"	1992-11-13	1992 Tournament of Champions quarterfinal game 5.
2	200	no	AMERICAN HISTORY	-	On October 24, 1952 Eisenhower vowed to go to this country & 5 weeks later, he did	Korea	1992-11-13	1992 Tournament of Champions quarterfinal game 5.
2	400	no	AMERICAN HISTORY	-	In 1732, Vincennes, in this future state, was founded by the French on the Wabash River	Indiana	1992-11-13	1992 Tournament of Champions quarterfinal game 5.
2	600	no	AMERICAN HISTORY	-	This 1941 act enabled the U.S. to become the "Arsenal of Democracy\"	The Lend-Lease Act	1992-11-13	1992 Tournament of Champions quarterfinal game 5.
2	800	no	AMERICAN HISTORY	-	On May 13, 1846, President James K. Polk signed a declaration of war against this country	Mexico	1992-11-13	1992 Tournament of Champions quarterfinal game 5.
2	1000	no	AMERICAN HISTORY	-	On Dec. 26, 1799 this general eulogized George Washington in Congress	\"Light-Horse Harry" Lee	1992-11-13	1992 Tournament of Champions quarterfinal game 5.
2	200	no	PHILOSOPHY	-	Transcendentalist philosopher Bronson Alcott was the father of this famous authoress	Louisa May Alcott	1992-11-13	1992 Tournament of Champions quarterfinal game 5.
